{
  "$schema": "https://json-schema.org/draft/2020-12/schema",
  "$id": "assay:payload",
  "title": "Assay Result Payload",
  "description": "Payload produced by Assay and written to the configured output directory. One file per run, named assay-<timestamp>-<uuid>.json.",
  "type": "object",
  "required": ["verification_id", "task_id", "issue_type", "severity", "outcome", "summary"],
  "additionalProperties": false,
  "properties": {
    "verification_id": {
      "type": "string",
      "minLength": 1,
      "description": "Stable ID assigned by Assay at submission time."
    },
    "task_id": {
      "type": ["string", "null"],
      "description": "Grain task packet ID being verified (e.g. TASK-0070). Null for standalone runs."
    },
    "issue_type": {
      "type": "string",
      "enum": ["test_failure", "bug_finding", "screenshot_evidence", "trace_capture", "human_annotation"],
      "description": "Category of the verification finding."
    },
    "severity": {
      "type": "string",
      "enum": ["info", "warning", "error", "critical"],
      "description": "Severity level of the finding."
    },
    "outcome": {
      "type": "string",
      "enum": ["pass", "fail", "inconclusive"],
      "description": "Verification result."
    },
    "summary": {
      "type": "string",
      "minLength": 1,
      "description": "Human-readable description of the finding."
    },
    "artifact_refs": {
      "type": "array",
      "items": { "type": "string", "minLength": 1 },
      "description": "Paths or URIs to captured artifacts (screenshots, logs, traces)."
    },
    "followup_candidates": {
      "type": "array",
      "items": {
        "type": "object",
        "required": ["title", "description"],
        "additionalProperties": false,
        "properties": {
          "title": { "type": "string", "minLength": 1 },
          "description": { "type": "string", "minLength": 1 }
        }
      },
      "description": "Proposed follow-up work items for operator review."
    },
    "verified_at": {
      "type": ["string", "null"],
      "format": "date-time",
      "description": "ISO 8601 datetime when Assay completed the verification run."
    }
  }
}
