{"verification_id": "8873d523-8ebf-4546-bfcf-815bb26baf5b", "task_id": null, "issue_type": "screenshot_evidence", "severity": "info", "outcome": "inconclusive", "summary": "SDK capture: https://example.com \u2014 looks broken", "artifact_refs": [], "followup_candidates": [], "verified_at": "2026-04-18T10:00:00Z"}