{"verification_id": "08e39514-531e-4d4b-87fc-5cdbeae0bc76", "task_id": null, "issue_type": "screenshot_evidence", "severity": "info", "outcome": "inconclusive", "summary": "SDK capture: https://example.com \u2014 looks broken", "artifact_refs": [], "followup_candidates": [], "verified_at": "2026-04-18T10:00:00Z"}