{"verification_id": "abc909b0-ae02-49b1-874d-2718d5c1e5ff", "task_id": null, "issue_type": "screenshot_evidence", "severity": "info", "outcome": "inconclusive", "summary": "SDK capture: https://example.com \u2014 looks broken", "artifact_refs": [], "followup_candidates": [], "verified_at": "2026-04-18T10:00:00Z"}