{"verification_id": "e01341c4-94df-4a01-bebf-fb89a4a0c7b0", "task_id": null, "issue_type": "screenshot_evidence", "severity": "info", "outcome": "inconclusive", "summary": "SDK capture: https://example.com \u2014 looks broken", "artifact_refs": [], "followup_candidates": [], "verified_at": "2026-04-18T10:00:00Z"}