{"verification_id": "9efd449f-2328-4466-8fe6-607c5294673a", "task_id": null, "issue_type": "screenshot_evidence", "severity": "info", "outcome": "inconclusive", "summary": "SDK capture: https://example.com \u2014 looks broken", "artifact_refs": [], "followup_candidates": [], "verified_at": "2026-04-18T10:00:00Z"}